{
  "$schema": "G7_HUMAN_FREEZE_DECISIONS.schema.json",
  "schema_id": "ABLEPATH_G7_HUMAN_FREEZE_DECISIONS",
  "schema_version": "1.0.0-review.1",
  "document_role": "REVIEW_ONLY",
  "source_commit": "515955000d3df28b5b20e468a6312a006f7f95ea",
  "freeze_record": {
    "status": "NOT_RECORDED",
    "record_id": null,
    "reviewer_name": null,
    "reviewer_role": null,
    "decision_date": null,
    "signature_or_review_record": null,
    "source_commit": null
  },
  "gates": {
    "m6": {
      "status": "READY_FOR_HUMAN_FREEZE",
      "result_status": "NOT_COMPUTED",
      "production_calculation_enabled": false
    },
    "hokonavi": {
      "status": "READY_FOR_HUMAN_FREEZE",
      "production_adapter_enabled": false
    }
  },
  "decisions": [
    {
      "id": "H1",
      "lane": "M6",
      "title": "Claim scope",
      "recommended": "Report named-source conformance and profile assessment only as separate outputs; defer computation until both schemas are approved.",
      "alternatives": [
        "Conformance only",
        "Profile assessment only",
        "Defer all computation."
      ],
      "evidence": [
        "docs/review/M6_H1_H20_RECOMMENDATIONS.md#h1--claim-scope",
        "docs/reference/DESIGN.md FR-5/FR-7"
      ],
      "effect": "Prevents legal/source conformance from being presented as person-level traversability.",
      "checkbox": "[ ]",
      "selection": null,
      "blocking": {
        "m6": true,
        "hokonavi": false,
        "reason": "Unselected H1 blocks a complete signed M6 freeze; the production surface remains disabled."
      }
    },
    {
      "id": "H2",
      "lane": "M6",
      "title": "Japanese source applicability",
      "recommended": "Require authoritative edge-level applicability before Japanese conformance; otherwise keep that output NOT_COMPUTED.",
      "alternatives": [
        "Apply a national clause without edge proof",
        "Omit Japanese conformance from v1."
      ],
      "evidence": [
        "docs/review/M6_EVIDENCE_MATRIX.md S1-S2",
        "docs/review/M6_H1_H20_RECOMMENDATIONS.md#h2--japanese-source-applicability"
      ],
      "effect": "Avoids asserting a rule applies without road, administrator, ordinance, or trigger evidence.",
      "checkbox": "[ ]",
      "selection": null,
      "blocking": {
        "m6": true,
        "hokonavi": false,
        "reason": "Unselected H2 blocks a complete signed M6 freeze; the production surface remains disabled."
      }
    },
    {
      "id": "H3",
      "lane": "M6",
      "title": "First executable profile",
      "recommended": "Keep production profile count zero now; consider one immutable manual-wheelchair-independent reference only after all remaining gates.",
      "alternatives": [
        "Promote a width-only profile now",
        "Promote multiple device profiles",
        "Approve one profile after all gates."
      ],
      "evidence": [
        "docs/review/M6_H1_H20_RECOMMENDATIONS.md#h3--first-executable-profile",
        "docs/review/M6_STATE_TABLE_OPTIONS.md#profileattribute-readiness"
      ],
      "effect": "Keeps every profile result NOT_COMPUTED until a complete validated profile exists.",
      "checkbox": "[ ]",
      "selection": null,
      "blocking": {
        "m6": true,
        "hokonavi": false,
        "reason": "Unselected H3 blocks a complete signed M6 freeze; the production surface remains disabled."
      }
    },
    {
      "id": "H4",
      "lane": "M6",
      "title": "Required attributes",
      "recommended": "Use a closed required/optional attribute set per immutable profile; unresolved required attributes cannot yield PASS.",
      "alternatives": [
        "Width only",
        "One shared attribute set for all profiles",
        "Defer the attribute schema."
      ],
      "evidence": [
        "docs/review/M6_H1_H20_RECOMMENDATIONS.md#h4--required-attributes",
        "docs/review/M6_EVIDENCE_MATRIX.md S1-S7/S11"
      ],
      "effect": "Prevents width-only overclaim and profile aliasing.",
      "checkbox": "[ ]",
      "selection": null,
      "blocking": {
        "m6": true,
        "hokonavi": false,
        "reason": "Unselected H4 blocks a complete signed M6 freeze; the production surface remains disabled."
      }
    },
    {
      "id": "H5",
      "lane": "M6",
      "title": "Comparator and source binding",
      "recommended": "Do not bind production values until humans select one named source or a closed precedence rule per attribute.",
      "alternatives": [
        "One named source per comparator",
        "Documented source hierarchy",
        "Aggregate values across sources."
      ],
      "evidence": [
        "docs/review/M6_H1_H20_RECOMMENDATIONS.md#h5--comparatorsource-binding",
        "docs/review/M6_INTERNATIONAL_STANDARDS_COMPARISON.md"
      ],
      "effect": "Keeps value, operator, edition, exceptions, and applicability together.",
      "checkbox": "[ ]",
      "selection": null,
      "blocking": {
        "m6": true,
        "hokonavi": false,
        "reason": "Unselected H5 blocks a complete signed M6 freeze; the production surface remains disabled."
      }
    },
    {
      "id": "H6",
      "lane": "M6",
      "title": "Equality semantics",
      "recommended": "Preserve each source operator for conformance and freeze profile equality separately; keep profile NOT_COMPUTED meanwhile.",
      "alternatives": [
        "Equality always PASS",
        "Equality always CONDITIONAL",
        "Equality always FAIL."
      ],
      "evidence": [
        "docs/review/M6_H1_H20_RECOMMENDATIONS.md#h6--equality-semantics",
        "docs/review/M6_STATE_TABLE_OPTIONS.md#symbolic-width-and-constriction-table"
      ],
      "effect": "Prevents a universal equality state from being invented.",
      "checkbox": "[ ]",
      "selection": null,
      "blocking": {
        "m6": true,
        "hokonavi": false,
        "reason": "Unselected H6 blocks a complete signed M6 freeze; the production surface remains disabled."
      }
    },
    {
      "id": "H7",
      "lane": "M6",
      "title": "Short constriction",
      "recommended": "Defer production exceptions; retain ADA and DfT structures only as separate non-executable comparators until validated.",
      "alternatives": [
        "No exception",
        "Adopt the complete named ADA rule",
        "Adopt the complete named DfT rule",
        "Create a validated AblePath rule."
      ],
      "evidence": [
        "docs/review/M6_H1_H20_RECOMMENDATIONS.md#h7--short-constriction",
        "docs/review/M6_STATE_TABLE_OPTIONS.md#symbolic-width-and-constriction-table"
      ],
      "effect": "Prevents mixing width, length, spacing, and surrounding-space clauses.",
      "checkbox": "[ ]",
      "selection": null,
      "blocking": {
        "m6": true,
        "hokonavi": false,
        "reason": "Unselected H7 blocks a complete signed M6 freeze; the production surface remains disabled."
      }
    },
    {
      "id": "H8",
      "lane": "M6",
      "title": "Aggregation and direction",
      "recommended": "Use independent attribute results with no overall state for v1 review; adopt a compound model only after target validation.",
      "alternatives": [
        "Worst-required-attribute gate",
        "Validated compound model",
        "Weighted score."
      ],
      "evidence": [
        "docs/review/M6_H1_H20_RECOMMENDATIONS.md#h8--attribute-aggregation-and-direction",
        "docs/review/M6_STATE_TABLE_OPTIONS.md#attribute-aggregation-options"
      ],
      "effect": "Avoids an unvalidated overall state and preserves ascent/descent meaning.",
      "checkbox": "[ ]",
      "selection": null,
      "blocking": {
        "m6": true,
        "hokonavi": false,
        "reason": "Unselected H8 blocks a complete signed M6 freeze; the production surface remains disabled."
      }
    },
    {
      "id": "H9",
      "lane": "M6",
      "title": "Meaning of CONDITIONAL",
      "recommended": "If used, freeze a disjoint closed condition vocabulary with reason codes; otherwise keep affected cases UNKNOWN.",
      "alternatives": [
        "Source exception only",
        "Verified assistance only",
        "Bounded operation only",
        "Soft cost only",
        "No CONDITIONAL in the first profile."
      ],
      "evidence": [
        "docs/review/M6_H1_H20_RECOMMENDATIONS.md#h9--meaning-of-conditional",
        "docs/review/M6_STATE_TABLE_OPTIONS.md#conditional-options"
      ],
      "effect": "Prevents unlike exceptions, assistance, operation, and costs from collapsing into one opaque state.",
      "checkbox": "[ ]",
      "selection": null,
      "blocking": {
        "m6": true,
        "hokonavi": false,
        "reason": "Unselected H9 blocks a complete signed M6 freeze; the production surface remains disabled."
      }
    },
    {
      "id": "H10",
      "lane": "M6",
      "title": "Hard exclusion versus soft cost",
      "recommended": "Keep the hard-exclusion list empty until validated; later allow only a frozen physical hard exclusion to create FAIL.",
      "alternatives": [
        "Every source non-conformance creates FAIL",
        "Speed/cost evidence creates FAIL",
        "Approve a closed validated hard list."
      ],
      "evidence": [
        "docs/review/M6_H1_H20_RECOMMENDATIONS.md#h10--hard-exclusion-versus-soft-cost",
        "docs/review/M6_IMPLEMENTATION_CONTRACT.md"
      ],
      "effect": "Prevents performance evidence from being mislabeled as physical impossibility.",
      "checkbox": "[ ]",
      "selection": null,
      "blocking": {
        "m6": true,
        "hokonavi": false,
        "reason": "Unselected H10 blocks a complete signed M6 freeze; the production surface remains disabled."
      }
    },
    {
      "id": "H11",
      "lane": "M6",
      "title": "Closure precedence",